Timestamp	Strana	Vyplňuje (jméno osoby)	Bezpečnostní kód	1. Měla by být regulována reklama v centru města?	Případný komentář k otázce 1	2. Mělo by být parkování na celém území města zdrama?	Případný komentář k otázce 2	3. Jste spokojeni s celkovým směřováním města za posledních 5 let?	Případný komentář k otázce 3	4. MHD v Trutnově by měla být pro cestující zdarma.	Případný komentář k otázce 4	5. Mělo by město Trutnov zveřejňovat všechny uzavřené smlouvy s firmami na internetu?	Případný komentář k otázce 5	6. Měl by být na Trutnovsku povolen výzkum těžby břidlicového plynu?	Případný komentář k otázce 6	7. Souhlasíte se stavbou parkovacího domu v centru Trutnova?	Případný komentář k otázce 7	8. Mělo by město postavit odbavovací halu na autobusovém nádraží?	Případný komentář k otázce 8	9. Podporujete aktuálně probíhající přestavbu Krakonošova náměstí?	Případný komentář k otázce 9	10. Mělo by město Trutnov více dotovat kulturní dění ve městě?	Případný komentář k otázce 10	11. Jste pro rozšíření sítě cyklostezek ve městě?	Případný komentář k otázce 11	12. Mělo by město věnovat zvýšenou pozornost technickému stavu komunikací v okrajových částech města?	Případný komentář k otázce 12	13. Mělo by město finančně podporovat provoz škol více než doposud?	Případný komentář k otázce 13	14. Mělo by město finančně podporovat Trutnov Open Air Festival?	Případný komentář k otázce 14	15. Mělo by být na některých veřejných místech v Trutnově (nádraží, park atd.) zakázáno pít alkohol?	Případný komentář k otázce 15	16. Jste pro zrušení Městské policie v Trutnově?	Případný komentář k otázce 16	17. Může se město kvůli důležité investici výrazněji zadlužit?	Případný komentář k otázce 17	18. Podporujete rozrůstání města do nově vzniklých okrajových částí?	Případný komentář k otázce 18	19. Měla by být v areálu Na Nivách postavena kuželna?	Případný komentář k otázce 19	20. Mělo by město podpořit vznik dalších supermarketů přicházejících do Trutnova?	Případný komentář k otázce 20	21. Město by mělo stavět další dětská hřiště?	Případný komentář k otázce 21	22. Byli byste pro uspořádání závazného městského referenda v klíčových otázkách?	Případný komentář k otázce 22	23. Měl by Trutnov rozšiřovat městský kamerový systém?	Případný komentář k otázce 23	24. Mělo by město pokračovat v podpoře umisťování uměleckých děl ve veřejných prostorech jako doposud?	Případný komentář k otázce 24	25. Měly by být všechny herny v Trutnově zakázány?	Případný komentář k otázce 25	26. Mělo by město více finančně podporovat trutnovské sportovní a tělovýchovné organizace?	Případný komentář k otázce 26	27. Mělo by město zařídit zvýšení počtu míst ve veřejných mateřských školách?	Případný komentář k otázce 27	28. Souhlasíte s tím, že správa sportovišť byla převedena z TJ Lokomotiva na Městský bytový podnik (nyní Městské byty a sportoviště)?	Případný komentář k otázce 28	29. Mělo by město více investovat na rozšíření počtu míst v domovech pro seniory i za cenu zvýšení výdajů městského rozpočtu?	Případný komentář k otázce 29	30. Měl by být krytý bazén rekonstruován a rozšířen o aquapark?	Případný komentář k otázce 30	31. Přáli byste si zřízení dalších jeslí v Trutnově?	Případný komentář k otázce 31	32. Mělo by v Radničních listech být více prostoru pro názory občanů a opozičních stran?	Případný komentář k otázce 32	33. Měl by Trutnov podporovat vytvoření pobočky další vysoké školy?	Případný komentář k otázce 33	34. Mělo by město zavést automatizovaný systém půjčování kol?	Případný komentář k otázce 34	22. Byli byste pro uspořádání závazného městského referenda v klíčových otázkách?
9/22/2014 4:23:45	Test	Test	123456	Ne		Ne		Ne		Ne		Ne		Ne		Ne		Ne		Ne		Ne		Ne		Ne		Ne		Ne		Ne		Ne		Ne		Ne		Ne		Ne		Ne		Ne		Ne		Ne		Ne		Ne		Ne		Ne		Ne		Ne		Ne		Ne		Ne		Ne		
9/25/2014 21:39:50	Žít v Trutnově - Zelení, LES a Piráti	Martin Jiránek	334056	Ano		Ne		Ne	Tato otázka je z našeho pohledu mimo. Je to nespecifické. Směřování města v průhledností financí? Směřování města z pohledu opravování a renovací?	Ano		Ano		Ne		Ne		Ano		Ano		Ano	Na tuto otázku musí takřka každý člověk říci ano. Co třeba se zeptat, zda by se mělo více dotovat za cenu zadlužování města. Nebo zda by se měla podporovat více alternativní kultura? Nebo zda by měli lidé sami více rozhodovat o tom, na jakou kulturu půjdou jejich peníze?  	Ano		Ano	Opět každý řekne ano. Co třeba se zeptat tak, že ... Máte pocit, že okrajové obce jsou podporovány dostatečně? 	Ano	Opět otázka, na kterou jen absolutní negativista z pohledu vzdělání napíše ne. Co třeba tak, že mělo by město podporovat provoz škol podle toho, který ředitel školy je ve které straně? Nebo co třeba, zda by město mělo podporovat školy nebo alternativní studium (Montessori a Waldorfská škola)?	Ano		Ano		Ne		Ano	Vše je s ohledem na to, zda je město v ekonomické kondici. Nyní jsme kvůli Uffu zadluženi opravdu dost. A co kdyby to nejdřív lidé odsouhlasili v referendu?	Ne	Jakých částí? Nové Dvory nebo průmyslová zóna? Přidat několik domů tam, kde jich již několik je, nebo stavět na zelené louce?	Ne		Ne		Ano		Ano	Jednoznačně.	Ne		Ano		Ano	Poker není hazard.	Ano	Mělo by město více finančně podporovat sport v Trutnově, pokud to budou odsouhlasovat obyvatelé v referendech?	Ano		Nevíme / nemáme jednotný názor	Pro běžného voliče je to nejasná otázka. Nevidíme výhody ani nevýhody.	Ano		Ne	Napište zde, kolik by to stálo. Žít v Trutnově přitáhnout turisty do aquaparku podporuje, ale ne za cenu 2 miliard. Navíc ten popisek velmi silně ovlivňuje čtenáře pro stavbu. Atraktivní pro občany, úspěšný oddíl... Žít v Trutnově říká ne, protože na to nyní nemáme.	Ano		Ano		Ano		Ano		
9/26/2014 14:23:26	Test	Test	222222222	Nevíme / nemáme jednotný názor		Nevíme / nemáme jednotný názor		Nevíme / nemáme jednotný názor		Nevíme / nemáme jednotný názor		Nevíme / nemáme jednotný názor		Nevíme / nemáme jednotný názor		Nevíme / nemáme jednotný názor		Nevíme / nemáme jednotný názor		Nevíme / nemáme jednotný názor		Nevíme / nemáme jednotný názor		Nevíme / nemáme jednotný názor		Nevíme / nemáme jednotný názor		Nevíme / nemáme jednotný názor		Nevíme / nemáme jednotný názor		Nevíme / nemáme jednotný názor		Nevíme / nemáme jednotný názor		Nevíme / nemáme jednotný názor		Nevíme / nemáme jednotný názor		Nevíme / nemáme jednotný názor		Nevíme / nemáme jednotný názor		Nevíme / nemáme jednotný názor		Nevíme / nemáme jednotný názor		Nevíme / nemáme jednotný názor		Nevíme / nemáme jednotný názor		Nevíme / nemáme jednotný názor		Nevíme / nemáme jednotný názor		Nevíme / nemáme jednotný názor		Nevíme / nemáme jednotný názor		Nevíme / nemáme jednotný názor		Nevíme / nemáme jednotný názor		Nevíme / nemáme jednotný názor		Nevíme / nemáme jednotný názor		Nevíme / nemáme jednotný názor		Ano		
9/26/2014 21:15:13	ODS 	Ivan Adamec 	763215	Ne	Naopak. V centru města mají živnostníci ztížené podnikání (kvůli parkování apod.). Nevidím důvod, proč reklamu omezovat. 	Ne	Parkovné se neplatí pro zisk do městské pokladny, ale z důvodů regulace.	Ano	Jsem spokojen s vývojem města za posledních 24 let. Samozřejmě je stále co zlepšovat 	Ne	V životě není nic zadarmo. 	Ano	Ano, argumenty odpůrců mi nevadí. Spíše mi vadí administrativní náročnost malých zakázek. 	Ne	V dnešní době je tento problém již irelevantní. 	Nevíme / nemáme jednotný názor	Nevím, jaké místo máte na mysli. Ale pokud se jedná o parkovací dům v souladu s územním plánem, tak ano. 	Ano	Ano, ale nemělo by ji financovat. Tato aktivita je již dávno připravena. Chybí pouze investor. 	Ano		Ne	Podpory není nikdy dost, ale záleží na aktuálním stavu rozpočtu. 	Ano	Také jsem pro rozšíření drah pro in-line brusle a lyže. 	Ano	Ano, již se tak děje – pokud jsou komunikace městské. 	Ne	Díky dobrému hospodaření jednotlivých škol zbylo na investice dost peněz. Školským pracovníkům bych přidal více peněz, ale bohužel je platí stát. 	Ne		Ne		Ne		Ano	Výjimečně ano a nesouhlasím s tím, že se město výrazně zadlužilo. 	Nevíme / nemáme jednotný názor	Nerozumím otázce. 	Ano		Ne	Město toto nikdy aktivně nepodporovalo. 	Ano		Ne	V zastupitelských otázkách mám vážné pochybnosti o účelnosti referenda. Nežijeme ve Švýcarsku, kde je referendum základem demokracie. 	Ano	Spíše ano, v lokalitách se zvýšeným potenciálem kriminality. 	Ano		Ne	Zkušenosti s prohibicí či s úplným zákazem čehokoliv jsou alarmující. 	Ne	Opět záleží na výši rozpočtu.	Ne	Trutnov je jedno z mála měst, které má převis v počtu mateřských škol. 	Ano		Ne	Máme dostatek zařízení DPS i vlastní domov důchodců. 	Ne	Typický aquapark tu nebude nikdy. Dokážu si představit rekonstrukci krytého bazénu, přidání toboganu a vířivky. 	Ne		Ne	V našem městě jsou Radniční listy pouze informačním zpravodajem, a ne prostorem pro výměnu názorů. 	Ano		Ano	Proč ne? 	
9/26/2014 21:39:41	Úsvit přímé demokracie	Václav Török	604508	Ano	Ano, historické centrum města s pěší zónou by měli být regulovány.	Ne	Ne, již v dnešní době je parkování regulováno poplatkem. V případě zrušení poplatku by bylo centrum plné aut. Zhoršila by se celková dopravní situace v centru města.	Ne	Nejsme spokojeni. Město je zadlužené a chybí peníze na větší investice do infrastruktury v okrajových částech města.	Ano	Děti do 15 let ZDARMA a důchodci nad 65 let ZDARMA.	Ano	Ano, všechny smlouvy a výběrová řízení by měla být jednoduše dostupná na internetu. Jedná se o jeden z klíčových bodů našeho volebního programu.	Ne	Rozhodně jsme proti jakékoliv těžbě břidlicového plynu na Trutnovsku.	Ano		Ano	Ano, prosazujeme výstavbu odbavovacího terminálu autobusového nádraží v Trutnově. jedná se o jeden z klíčových bodů našeho programu.	Ne		Ne	Stávající dotace jsou plně dostačující.	Ano	Ano jsme pro rozšíření cyklostezek a stezek pro in-line bruslaře a jsme pro zkvalitnění povrchu na této stezce co vede ze Zelené louky až ke psímu útulku.	Ano	Komunikace v okrajových částech města jsou hodně zanedbané a podfinancované.	Ano		Ne		Ano		Ne	Městská policie plní svoji úlohu výborně a skvěle sekunduje státní policii.	Ne	V současné době splácí město cca 250 mil. Kč dluhů, další dluhy již nebudeme tolerovat.	Ano	Jedná se o jeden z klíčových bodů našeho programu, rozvoj města a podpora zvyšování počtu obyvatel.	Ano		Ne	V současné době je v Trutnově dostatečné množství supermarketů a hypermarketů. Pro další již vzhledem ke kupní síle obyvatel Trutnova není prostor.	Ano	Ano, současné vedení nepodporovalo výstavbu dětských hřišť, jediné hřiště vysoutěžili obyvatelé Trutnova v soutěži řetězce Lidl.	Ano	Pro Hnutí Úsvit přímé demokracie se jedná o klíčové téma. O důležitých věcech by měli rozhodovat sami občané v referendu a ne politici.	Ano		Ano		Ne		Ano		Ano		Ano		Ano		Ano		Ano		Ano	Ano v současné době nemají opoziční strany žádný prostor a jakýkoliv projev, který není v souladu se současnou vládnoucí garniturou je těžce potlačován. k tomu potlačování je používáno i soukromé médium financované z městských peněz.	Ano		Ne		
9/28/2014 20:37:34	ČSSD	Roman Hásek	360251	Ano		Ne		Ano	S výhradami k některým finančním záležitostem - např. podfinancování provozních rozpočtů škol, financování sportu, prodej pozemků. Některé kauzy jsou nejasné a neprůhledné.	Ano		Ano		Ne		Ne	Město by spíše mělo motivovat občany k nepoužívání osobních automobilů. Snížit počet aut ve městě může MHD pro občany Trutnova zdarma a podpora cyklistů.	Nevíme / nemáme jednotný názor		Ano		Ne	Částka je dostatečná.	Ano		Ano	Především by město mělo věnovat pozornost těm komunikacím, které jsou nejvíce využívány.	Ano	A motivovat ředitele škol k řádné a důsledné údržbě budov.	Ne		Ano		Ne		Ne		Ano		Nevíme / nemáme jednotný názor		Ne	Město by mělo nyní podpořit místní podnikatele, kteří mohou poskytnout stejnou službu, vytváří rovněž pracovní místa a zisky zůstávají v Trutnově.	Ano		Ano		Ne		Ano		Ano	Zákazu musí předcházet řešení výpadku 18 miliónů pro město.	Ano	Spravedlivě, podle jasných pravidel a ty sportovní kluby, které pečují o děti a mládež.	Ano	Ale pouze v případě, že bude předem jasný převis poptávky. Počet dětí bude demograficky klesat, spíše jsme pro prodloužení provozní doby ve vybraných odděleních.	Ano		Ano	Počet seniorů bude narůstat a město má povinnost vytvářet jim důstojné podmínky.	Ano	Může k tomu město využít i jiné prostředky než jenom městské.	Ano		Ano	Jednoznačně.	Ano		Ano		