points,polarity!,year,id,name,question,description,old_description,link,old_order,document_link,order
3,,2014,59773,Práva zákazníků operátorů,Hlasoval/a bych pro snížení práv a ochrany zákazníků mobilních operátorů.,Novela zhoršuje zejména postavení podnikatelů a firem. Ti musí nově při předčasném odstoupení od smlouvy uhradit celý zbývající závazek. Pro všechny zákazníky se např. nově zhoršují možnosti jak mobilního operátora opustit bez sankcí.,"Novela zákona o elektronických komunikacích zhoršuje zejména postavení zákazníků, kteří zároveň nejsou spotřebiteli, tedy např. podnikatelů a firem. Ti musí nově při předčasném odstoupení od smlouvy uhradit celý zbývající závazek, je redukována jejich možnost uzavřít smlouvu na dálku atd. Pro všechny zákazníky se např. nově zhoršují možnosti jak mobilního operátora opustit bez sankcí.",http://www.psp.cz/sqw/hlasy.sqw?g=59773,8,http://www.psp.cz/sqw/historie.sqw?o=7&T=135,39
4,,2017,62898,Blokování webů jen soudy,"O blokování webových stránek kvůli nepovolenému hazardu by měl rozhodovat soud, nikoliv ministerští úředníci","Vláda navrhla, aby webové stránky s hazardem, které nejsou povolené v ČR, mohlo Ministerstvo financí nechat blokovat. Zastánci návrhu poukazovali na pomalost soudů v ČR, odpůrci na možnost cenzurování ze strany MFČR.","Vláda navrhla, aby webové stránky s hazardem, které nejsou povolené v ČR, mohlo Ministerstvo financí nechat blokovat. Zastánci návrhu poukazovali na pomalost soudů v ČR, odpůrci na možnost cenzurování ze strany MFČR.",,,http://www.psp.cz/sqw/historie.sqw?T=578&O=7,40
3,1,2015,61186,Zpravodajské služby,Zpravodajské služby by měly mít možnost používat data mobilních operátorů,"Příslušný návrh rozšiřuje pravomoci zpravodajských služeb, nově by měly mít možnost např. zjistit majitele telefonního čísla. Omezí se rovněž ochrana údajů bankovním tajemstvím. Podle zastánců návrh pomůže v boji proti kriminalitě, podle odpůrců povede k omezení soukromí občanů.","Příslušný návrh rozšiřuje pravomoci zpravodajských služeb, nově by měly mít možnost např. zjistit majitele telefonního čísla. Omezí se rovněž ochrana údajů bankovním tajemstvím. Podle zastánců návrh pomůže v boji proti kriminalitě, podle odpůrců povede k omezení soukromí občanů.",,12,http://www.psp.cz/sqw/historie.sqw?T=400,41
4,,2017,62855,Čapí hnízdo – přerušení,Hlasoval/a byste pro přerušení jednání Sněmovny o Čapím hnízdě?,"Ve Sněmovně se projednával bod Kauza Čapí hnízdo a padl návrh, aby se projednání přerušilo až do zveřejnění výsledků šetření této věci od OLAF (Evropský úřad pro boj proti podvodům), tj. až do doby po volbách.","Ve Sněmovně se projednával bod Kauza Čapí hnízdo a padl návrh, aby se projednání přerušilo až do zveřejnění výsledků šetření této věci od OLAF (Evropský úřad pro boj proti podvodům), tj. až do doby po volbách.",,,,42
4,,2017,66509,Souhlas se stíháním poslance,Policie měla mít možnost obvinit poslance Novotného,Poslance Novotného a Borku chtěla policie obvinit v případu machinací s evropskými dotacemi v Karlovarském a Ústeckém kraji.,Poslance Novotného a Borku chtěla policie obvinit v případu machinací s evropskými dotacemi v Karlovarském a Ústeckém kraji.,,,http://www.psp.cz/eknih/2013ps/stenprot/057schuz/s057364.htm,43
4,1,2015,61685,Velký pátek,Velký pátek by měl být státním svátkem,,,,8,http://www.psp.cz/sqw/historie.sqw?T=491,44
5,,2016,62358,EET,Hlasoval/a bych pro zavedení EET (elektronické evidence tržeb),"Elektronická evidence tržeb (EET) vyžaduje, aby každá tržba v restauraci nebo obchodě (a za další služby od příštího roku) byla okamžitě odeslána po internetu Finanční správě. ","Elektronická evidence tržeb (EET) vyžaduje, aby každá tržba v restauraci nebo obchodě byla okamžitě odeslána po internetu Finanční správě. Na další služby má EET začít platit v příštím roce.",,,http://www.psp.cz/sqw/historie.sqw?T=514&O=7,45
